offre_id,dossier_id,fichier_source,nom_repreneur,forme_juridique_repreneur,capital_repreneur,rcs_repreneur,adresse_repreneur,dirigeant_repreneur,groupe_appartenance,type_offre,date_offre,societe_cessionnaire,prix_total_eur,prix_incorporels_eur,prix_corporels_eur,emplois_repris,perimetre_actifs,exclusions,conditions_suspensives,mode_financement,ca_repreneur_eur,resultat_exploitation_repreneur_eur,resultat_net_repreneur_eur,total_actif_eur,capitaux_propres_eur,validite_offre,avocat_repreneur,notes
05-01,05,offre_01_gd74316210.pdf,SAS FINANCIERE DAUNOU 9,SAS à associé unique,600000,990820623,"9 rue Daunou, 75002 Paris","ETABLISSEMENTS GUILLAUME DE BOIS (Président — RCS Paris 948 828 579) / Guillaume de BOIS (associé unique, né 15/09/1977 Paris 15e, 4 square Léon Blum 92800 Puteaux)","Groupe Guillaume de Bois : Club Vendôme (7-9 rue Daunou 75002), Salons du Louvre (66 rue J-J Rousseau 75001, ex-Chez Lulu), Le Tape (25 rue Richelieu 75001, ex-Le Magnifique). Cédé fin 2025 : LA CALAVADOS (40 av Pierre 1er de Serbie 75008, ex-PIERRE 1ER HOSPITALITY)",Offre améliorée,2026-02-05,"LE GAGA (SAS à constituer, cap. 3000€, siège 9 rue Daunou 75002, Président ETABLISSEMENTS GUILLAUME DE BOIS) — capital : 50% FINANCIERE DAUNOU 9 / 25% Gary FICO (né 12/07/1986 Issy-les-Moulineaux) / 25% Antoine BASSE (né 14/09/1982 Vincennes)",281000,181000,100000,3,"Fonds de commerce complet : incorporels (bail commercial 16 av Friedland, clientèle, achalandage, base clients, autorisations administratives, licence IV, enseignes, nom commercial, marques, sites internet et noms de domaine, codes sources, comptes réseaux sociaux Instagram/Facebook/Pinterest/YouTube/Twitter, CRM, logiciels facturation/paie/compta) + corporels (mobilier, matériel, agencements inventoriés par WEDRYCHOWSKI-MAGNIN 05/03/2025) + stocks","Biens revendiqués ou sous réserve de propriété, contrats non spécifiquement listés, disponibilités, biens en contentieux/droit de rétention",Aucune (l'offre ne mentionne pas de condition suspensive — offre améliorée),Fonds propres (chèque banque 282.000€ à remettre en chambre du conseil),,,,,,"Jusqu'à la première des deux dates : jugement homologuant le plan ou 31 mars 2026",,"Offre améliorée vs offre initiale 80.000€ du 05/01/2026 (offre_08). Prix de cession 281.000€ + stocks 1.000€ + dépôt garantie 13.030,89€ + congés payés 21.400,73€ = valeur économique totale 316.431,62€. Substitution prévue par LE GAGA. Gary FICO et Antoine BASSE : producteurs de musique (LETO, Tal, Shy'm, M. Pokora, David Carreira, Kendji Girac, Claudio Capéo). FINANCIERE DAUNOU 9 créée 05/09/2025 (apport en nature 600k€ : 90 actions PIERRE 1ER HOSPITALITY). Annexes : Kbis, Statuts, CNI, projet statuts LE GAGA, prévisionnel 3 ans. Date entrée en jouissance : lendemain prononcé du jugement. Améliorée vs offre initiale 80k€ (offre_08)."
05-02,05,offre_02_gd74292371.pdf,Stéphane REGOLI,Personne physique,,,"125 rue Jean-Baptiste Charcot, 92400 Courbevoie",Stéphane Regoli (né 30/05/1984 Marseille),Indépendant (ancien Président société nettoyage industriel ~100 salariés / ex-actionnaire restaurant et bar / professeur de Mathématiques EIB Paris / joueur d'échecs 2250 Elo),Offre initiale,2026-01-06,"SAS à créer (en cours de constitution), contrôlée par Stéphane Regoli — futurs actionnaires : Stéphane Regoli + MIKCHA SARL (Charles-David Ohayon, 50.000€ LOI 5/01/2026) + Maxime Vachier-Lagrave (champion du monde de blitz)",1,,,0,"Droit au bail commercial (sous réserve droits bailleur), licence IV, matériel + agencements + stocks inventoriés (≈ 47.600€)","Aucun salarié repris au stade initial (postes à discuter avec les employés)",Aucune condition suspensive explicite,Fonds propres,,,,,,,"Concept bar à échecs premium : midi restauration bureaux + soir/nuit club d'échecs avec bar à cocktails (fermeture 2h max, contre 5h actuelle, conformité bail). Business plan : CA cible 913,8k€ TTC (831,3k HT) — résultat d'exploitation +221,9k€. Animations : vendredi rencontres haut niveau, samedi tournois blitz. Annexes : LOI MIKCHA 50.000€, lettre de soutien Maxime Vachier-Lagrave, attestation indépendance. Prix justifié par : absence de garantie, reprise en l'état, aléa juridique bail. Audience 06/01/2026 12h00."
05-03,05,offre_03_gd74292296.pdf,Antoine HENRIQUET,Personne physique,,,"66 rue de Chézy, 92200 Neuilly-sur-Seine",Antoine HENRIQUET (né 01/04/1996 Ris Orangis),Indépendant (École Hôtelière Glion / 6 mois Le Meurice 3* / WE EVENT / société HSOCIETY production musicale / RICORPORAT vin (stock ~300k€) / ONLYWINES achat-revente vin avec ancien Bacardi),Offre améliorée,2026-02-05,"SARL RAFA RESTAURATION (en cours d'immatriculation), cap. 1000€, siège 29 rue Tronchet 75008 Paris — co-gérants Flavien PROENCA (33%, né 16/03/1995 St-Cloud, ex-Directeur Achats S.D. Bros Consulting 5 ans, conseil hospitalité/vins/spiritueux) + Romain BACCQUART (33%, né 16/11/1990 Paris 12, 15 ans dans le vin/spiritueux, ex-Bacardi Martini, Salon Revue du Vin de France) — Antoine HENRIQUET 34%",313000,265400,46900,3,"Fonds de commerce partiel : incorporels (fonds + clientèle, licence IV, base clients, fichiers clientèle/fournisseurs/comptables, marques déposées, certificats PI, nom commercial, sites internet, noms de domaine, logiciels gestion + facturation + paie, CRM, comptes réseaux sociaux, codes sources, savoir-faire) + corporels (mobilier/matériel 36.900€ + agencements 10.000€ inventaire WEDRYCHOWSKI-MAGNIN 05/03/2025) + stocks (700€) + bail commercial SCI 16 av Friedland + contrats téléphonie/électricité","Créances clients, contrats non listés (annexe 6), assurances, biens sous clause réserve propriété, biens grevés sûretés L.642-12 al.4, contentieux, passif antérieur","(1) Audit nantissements concluant — aucun nantissement transférable ; (2) Aucune dégradation substantielle activité",Fonds propres (CIC soutien projet — annexe 13) + BFR 100.000€ en compte courant associés,,,,,,Jusqu'à offre améliorée suivante (article L.642-2),"Maître Albert SERFATY, SELARL DORLEAC AZOULAY ASSOCIES (2 rue de Sontay 75116 Paris — dorleac.azoulay@wanadoo.fr)","Offre améliorée vs offre initiale du 06/01/2026 (offre_05 : 80.000€ / 2 emplois). Saut de prix : 80.000 → 313.000€. Effort global avec congés payés 21.400,73€ = 334.400€. Concept : cave à vin 8ème arrondissement, dégustation grands vins d'exception, ambiance feutrée — bar à vin journée + soirée, déjeuners, plateaux dégustation, happy hour. Cave personnelle Henriquet valorisée 314k€. Substitution par RAFA RESTAURATION. Reprise 3 salariés (vs 2 initialement). Annexes : CNI, Statuts RAFA, inventaire, présentation projet, prévisionnel trésorerie, attestation stock, projet dégustation, mail CIC 05/02/2026. Bail repris malgré contentieux."
05-04,05,offre_04_gd72176328.pdf,Stéphane REGOLI,Personne physique,,,"125 rue Jean-Baptiste Charcot, 92400 Courbevoie",Stéphane Regoli (né 30/05/1984 Marseille),"Indépendant (idem 05-02)",Offre initiale,2026-01-06,"SAS à créer (idem 05-02)",1,,,0,"Idem 05-02 : Droit au bail, licence IV, matériel + agencements + stocks (≈ 47.600€)","Idem 05-02",Aucune,Fonds propres,,,,,,,"Document identique à offre_02 (REGOLI Stéphane, 1€, projet bar à échecs, business plan CA 913,8k€). Probable doublon de dépôt au greffe (même contenu, même date 06/01/2026 Courbevoie, mêmes annexes : LOI MIKCHA 50k€, soutien Vachier-Lagrave). Voir 05-02."
05-05,05,offre_05_gd72167620.pdf,Antoine HENRIQUET,Personne physique,,,"66 rue de Chézy, 92200 Neuilly-sur-Seine",Antoine HENRIQUET (né 01/04/1996 Ris Orangis),"Indépendant : École Hôtelière Glion (œnologie), Le Meurice, Lily's Club (avec dirigeant MY LITTLE FINGER), WE EVENT, HSOCIETY (compositions audiovisuelles, fusion Ahproduction/SATISFACTION groupe ARTHUR), RICORPORAT (vin, stock 300k€), ONLYWINES (avec ex-Bacardi)",Offre initiale,2026-01-06,"BLACKBASS (projet SASU, cap. 10.000€, Président Antoine HENRIQUET, siège Paris — activité bar/restaurant/sandwicherie/traiteur en gros et détail avec ou sans débit de boissons)",80000,32400,46900,2,"Fonds de commerce partiel : incorporels (fonds + clientèle, licence IV, base clients, fichiers, marques, certificats PI, sites internet, codes sources, logiciels, comptes réseaux sociaux, savoir-faire) + corporels (mobilier 36.900€ + agencements 10.000€) + stocks (700€) + bail commercial + contrats téléphonie/électricité","Créances clients, contrats non listés, assurances, biens sous CRP, biens grevés sûretés, titres participations, contentieux, passif antérieur","(1) Audit nantissements ; (2) Audit comptable et financier concluant exploitation cumulée bénéficiaire ; (3) Entrée d'un ou plusieurs investisseurs complémentaires au capital BLACKBASS à hauteur de 40.000€ d'ici offre améliorative",Fonds propres + BFR financé en fonds propres (à préciser dans offre améliorative),,,,,,Jusqu'à offre améliorative,"Maître Albert SERFATY, SELARL DORLEAC AZOULAY ASSOCIES","Stocks 700€ inclus en sus (total avec stocks = 80.700€). Reprise 2 salariés : Chef de partie + Cuisinier (Agent d'entretien non repris). Accompagnement dirigeant actuel envisagé. Projet bar à vin journée + dégustation soir, complémentaire à activité nocturne. Améliorée par offre du 05/02/2026 (05-03 : 313.000€ / 3 emplois) avec substitution RAFA RESTAURATION (vs BLACKBASS projet initial). Annexes : CNI, déclaration origine des fonds, lettre engagement L.642-3."
05-06,05,offre_06_gd72167606.pdf,Jean-Marc LE BRAS,Personne physique,,,"Domicilié chez L'AGENCE DU COMMERCE, 11 rue Labie, 75017 Paris",Jean-Marc LE BRAS (né 13/06/1974 Saint-Cyr-l'École),"Indépendant — assisté par WIMMO CONSULTING (L'AGENCE DU COMMERCE) RCS Paris 891 999 583",Offre initiale,2026-01-06,"Société en cours de constitution (gérance Monsieur LE BRAS Jean-Marc, siège 16 avenue de Friedland 75008 Paris)",30000,20000,10000,3,"Ensemble des éléments corporels et incorporels du fonds de commerce (restaurant, bar américain, grande licence) — matériel/mobilier selon inventaire Commissaire-Priseur + bail commercial 16 av Friedland","Aucun crédit-bail/leasing repris (aucun connu)",Aucune condition suspensive explicite,Chèque banque 30.000€ (100% prix offert) sur compte 2M&ASSOCIES en garantie,,,,,,Jusqu'à décision du Tribunal,"Mandataire de recherche : L'AGENCE DU COMMERCE (WIMMO CONSULTING), 11 rue Labie 75017 Paris","Reprise des 3 salariés avec ancienneté + congés payés sans prorata temporis. Aucun lien de parenté avec dirigeant actuel (déclaration L.642-3). Honoraires WIMMO CONSULTING + actes à charge acquéreur en sus du prix. Substitution prévue par société en cours de constitution gérée par LE BRAS. Reprise bail + ensemble contrats nécessaires à l'exploitation."
05-07,05,offre_07_gd72167575.pdf,NIKA CONSEIL SAS,SAS à associé unique,1000,905202834,"19 boulevard Victor Hugo, 92200 Neuilly-sur-Seine",Joseph Didier SAFFAR (Président, né 31/12/1966 Paris 10, demeurant 3 av Stéphane Mallarmé 75017 Paris — 100% capital),NIKA CONSEIL (conseil en stratégie de financement de projets — créée 19/10/2021),Offre initiale (projet de plan de redressement par voie de cession),2026-01-06,"AURUM 8 (SAS à constituer, cap. 1000€ divisé en 1000 actions de 1€, siège 16 av Friedland 75008 Paris) — Dirigeant : Arthur SILBEREIS (né 23/02/1991 Paris 15, 57 quai de Grenelle 75015 Paris)",10000,5000,4000,3,"Fonds de commerce : incorporels (Licence IV, nom commercial, clientèle, marque/licences/PI éventuelles si propriété, comptes réseaux sociaux propriétés société, logiciels et droits attachés, bail commercial 16 av Friedland conclu 01/04/2009) + corporels en pleine propriété selon inventaire Commissaire-Priseur (agencements, matériel/outillage industriel, matériel bureau/informatique, mobilier, matériel roulant) + stocks (1.000€) + dépôt garantie bail (remboursé à AJ)","Actifs corporels revendiqués / sous clause réserve propriété ; créances clients et autres créances ; immobilisations financières (sauf dépôt garantie bail)",Aucune condition suspensive explicite,"Fonds propres (apport en capital + comptes courants associés — 40k€ d'apport initial)",16000,14672,12428,15121,13428,,,"Substitution par AURUM 8 (cap. 1000€, président Arthur SILBEREIS). Compte de résultat prévisionnel N+1 à N+3 (en K€) : CA 875/893/910, RE 38/38/38, RN 29/29/29, CAF 33/34/35. Plan de financement : Emplois D = 35k€ (prix cession+dépôt 26k + droits 4k + BFR 5k) ; Ressources 40k€ apport. Maintien 3 emplois pendant 2 ans. Aucune cession d'actifs prévue 2 ans. Données fiscales NIKA CONSEIL (exercice clos 31/12/2022, durée 15 mois, période 01/10/2021-31/12/2022) : CA 16k€, RE 14,672k€, RN 12,428k€, Total actif 15,121k€, CP 13,428k€. Annexes : Kbis, Statuts, comptes annuels NIKA CONSEIL, CNI SAFFAR + SILBEREIS, liste contrats poursuivis."
05-08,05,offre_08_gd72167441.pdf,SAS FINANCIERE DAUNOU 9,SAS,200000,387790405,"107 rue de Tocqueville, 75017 Paris (Century 21 Horeca Paris — agence intermédiaire)","Guillaume De BOIS (Président via ETABLISSEMENTS GUILLAUME DE BOIS — RCS 948 828 579)","Idem 05-01 : Groupe Guillaume de Bois — Club Vendôme, Salons du Louvre, Le Tape, ex-La Calavados / PIERRE 1ER HOSPITALITY (cédée 1,030M€)",Offre initiale,2026-01-05,"FINANCIERE DAUNOU 9 agissant pour le compte de toutes sociétés constituées ou à constituer (faculté substitution L.642-9 al.3)",80000,70000,7000,3,"Fonds de commerce : incorporels (bail 16 av Friedland, clientèle, achalandage, logiciels/fichiers/droits liés exploitation, licence 4ème catégorie) + corporels (aménagements, agencements, installations, mobilier et matériel propriété) + stocks (3.000€)","Bail Paris : aucun crédit-bail ni contrat de prêt repris. Contrats : TPE/Assurance non poursuivis ; Bail+Gaz+Eau+Électricité poursuivis","La présente offre ne comporte aucune condition suspensive",Fonds propres (chèque banque ou virement intégral à l'audience) — sans recours à l'emprunt,,,,,,Jusqu'au 1er mars 2026 (prorogeable),"Jean-Paul EUSEBIO (Century 21 Horeca Paris, mandataire de représentation)","Prix total acquisition 80.000€ + Reconstitution dépôt garantie bail 15.927€ = Total Général 95.927€. Reprise 3 salariés (Chef partie + Agent entretien + Cuisinier) — maintien emploi 24 mois sans licenciement économique. Améliorée par 05-01 (offre du 05/02/2026 : 281.000€ / valeur économique 316.431€ avec dépôt 13.030,89€ et congés 21.400,73€, substitution LE GAGA). Note : capital FINANCIERE DAUNOU 9 indiqué 200.000€ sur en-tête Century 21 (capital agence) mais réel 600.000€ selon Kbis offre_01 (apport en nature PIERRE 1ER HOSPITALITY 90 actions). Pas de prévision cession 2 ans. Engagement confidentialité signé."
