offre_id,dossier_id,fichier_source,nom_repreneur,forme_juridique_repreneur,capital_repreneur,rcs_repreneur,adresse_repreneur,dirigeant_repreneur,groupe_appartenance,type_offre,date_offre,societe_cessionnaire,prix_total_eur,prix_incorporels_eur,prix_corporels_eur,emplois_repris,perimetre_actifs,exclusions,conditions_suspensives,mode_financement,ca_repreneur_eur,resultat_exploitation_repreneur_eur,resultat_net_repreneur_eur,total_actif_eur,capitaux_propres_eur,validite_offre,avocat_repreneur,notes
15-01,15,offre_04_gd72568418.pdf,MEDIVI,SAS,17832600,908193311,"91 avenue de la Republique, 75011 Paris",David HADDOUK (President) / Sylvain HADDOUK (DG),"Reseau PLACE DENTAIRE / Reseau DENTEKA (Haddouk) - 29 centres dentaires, CA agrege 39.317.630 EUR en 2025, ~450 salaries",Offre initiale,2026-01-12,"MEDIVI avec faculte de substitution au profit d'une structure dirigee par David/Sylvain HADDOUK (creation d'association prevue)",3,1,1,,"Actifs incorporels (patientele, achalandage, dossiers patients sous RGPD, logiciels, licences) + 89 lots corporels inventaire Mercier (16/10/2025) valorises 10.180 EUR (materiel 2.680 EUR + stocks 7.500 EUR)","Numero FINESS, tresorerie anterieure, creances anterieures, biens revendiques (BAIL ACTEA contrat 07/12/2020), tout engagement non repris","(1) Conclusion d'un nouveau bail ou accord du bailleur sur nouveau projet de bail avec MEDIVI ou substitut (levee au plus tard a l'audience) ; (2) Reprise des contrats de credit-bail beneficiant au Centre detenus par societes de gestion",Fonds propres,,,,,,Jusqu'a la decision du Tribunal,,"Offre initiale plancher avec prix [3] EUR symbolique (placeholder a remplir). Stocks 7.500 EUR mentionnes. Indivisible avec AMD Claye-Souilly, AMD Colmar 68 et ADOS 92. Garantie 20% du prix a depot + solde 2 jours ouvres avant audience. Annexes : Kbis MEDIVI (08/01/2026), statuts MEDIVI, plaquette MEDIVI 2024. Amelioree par 15-02 (27/01/2026), 15-03 (04/02/2026), puis 15-04 (11/02/2026)."
15-02,15,,MEDIVI,SAS,17832600,908193311,"91 avenue de la Republique, 75011 Paris",David HADDOUK (President) / Sylvain HADDOUK (DG),Reseau PLACE DENTAIRE / Reseau DENTEKA,Offre amelioree,2026-01-27,"MEDIVI / Association Centre Dentaire Enghien (creee 16/01/2026, President Ishac HADDOUK)",,,,,,,,,,,,,,,,"Offre amelioree mentionnee au preambule de l'offre 04/02/2026 (offre_03) et de l'offre finale (offre_02). Texte non present dans les PDFs du dossier (uniquement reference)."
15-03,15,offre_03_gd74075842.pdf,MEDIVI,SAS,17832600,908193311,"91 avenue de la Republique, 75011 Paris",David HADDOUK (President) / Sylvain HADDOUK (DG),Reseau PLACE DENTAIRE / Reseau DENTEKA,Offre amelioree,2026-02-04,"MEDIVI avec substitution Association Centre Dentaire Enghien (creee 16/01/2026, President Ishac HADDOUK) + VIVA SANTE (SAS 817772382/812772382 - reprise des baux Denteka)",1300,500,500,7,"Actifs incorporels (patientele, achalandage, dossiers patients RGPD, logiciels, licences) + actifs corporels (materiel/mobilier/equipements necessaires) hors biens revendiques BAIL ACTEA + stocks 300 EUR","Numero FINESS, tresorerie anterieure, creances anterieures, materiels revendiques BAIL ACTEA (location financiere 07/12/2020), tout engagement non repris, acomptes a rembourser","(1) Accord expres DENTIGEST + AJ : resiliation amiable du bail / nouveau bail OU cession du droit au bail (contrepartie 50.000 EUR a DENTIGEST) ; (2) Accord SAS POINT DENTAIRE pour bail 468 bd des Provinces Francaises Nanterre 92000 : resiliation amiable / cession droit au bail (50.000 EUR) ; (3) Accord expres bailleur Nanterre ; (4) Reprise contrats credit-bail DENTIGEST avec accord credit-bailleurs",Fonds propres (compte courant MEDIVI 14.164,16 EUR + tresorerie cumulee Reseau > 1.000.000 EUR atteste expert-comptable),39317630 (CA agrege Reseau PLACE DENTAIRE 2025),,,,,,,"7 emplois repris : 4 chirurgiens-dentistes omni-praticiens + 1 assistante dentaire + 2 secretaires medicales. Exclus : 2 secretaires medicales referentes. Charge augmentative : 11.000 EUR (financement poursuite exploitation 17/12/2025-31/01/2026 par MEDIVI) + congés payés repris + renonciation reconstitution acomptes (limite 10.000 EUR) + 50.000 EUR resiliation bail + reconstitution depot de garantie. Indivisible avec offre Colmar 68. Amelioree par 15-04 (11/02/2026, prix 2.600 EUR)."
15-04,15,offre_02_gd74677468.pdf,MEDIVI,SAS,17832600,908193311,"91 avenue de la Republique, 75011 Paris",David HADDOUK (President) / Sylvain HADDOUK (DG),"Reseau PLACE DENTAIRE / Reseau DENTEKA (Haddouk) - 29 centres dentaires, CA agrege 39.317.630 EUR en 2025, ~450 salaries",Offre amelioree (finale),2026-02-11,"MEDIVI avec substitution Association Centre Dentaire Enghien (creee 16/01/2026, President Ishac HADDOUK) + VIVA SANTE (SAS 812772382, dirigee par David HADDOUK - reprise des baux et credit-bail Denteka)",2600,600,300,7,"Actifs incorporels (patientele, achalandage, dossiers patients RGPD, logiciels, licences) + actifs corporels (89 lots inventaire Mercier, principalement unites de climatisation, refrigerateurs, purificateurs d'air, vestiaires - valeur estimee 12.180 EUR dont stock hygiene/consommables 7.500 EUR) appartenant en propre a AMD Enghien + stocks 1.700 EUR","Numero FINESS (non transferable), tresorerie anterieure, creances anterieures, biens revendiques BAIL ACTEA/MUTUALEASE (courrier 30/09/2025, dossier 181542), tout engagement non repris, contrats CDD (sauf professionnalisation/apprentissage), acomptes a rembourser, tout passif non expressement vise","(1) Jugement designant MEDIVI comme repreneur ; (2) DENTIGEST et AJ resilient le bail commercial 10/11/2020 GALIMMO/Consorts CAUCHOIX (L.622-14) et le credit-bail BAIL ACTEA/MUTUALEASE (L.622-13) contre indemnite forfaitaire 50.000 EUR HT ; (3) Cession du droit au bail Nanterre (POINT DENTAIRE/MEDIPOLE) pour 146.400 EUR en 7 mensualites (6x20.914 EUR + 20.916 EUR) ; (4) Reconstitution du depot de garantie ; (5) Indivisibilite avec offre Colmar 68","Fonds propres exclusivement (sans financement externe). MEDIVI compte courant 14.164,16 EUR. Attestation expert-comptable : tresorerie cumulee Reseau > 1.000.000 EUR. Versement immediat 1.300 EUR remis a l'administrateur judiciaire. Garantie prevue : 20% a depot + solde 2j ouvres avant audience.",39317630 (CA agrege Reseau PLACE DENTAIRE 2025),,,,,Jusqu'a la decision du Tribunal,Cabinet PZ Avocats - Paul ZEITOUN / Delphine MENGEOT (9 Villa Aublet 75017 Paris - contact@pz-avocats.com),"Offre amelioree FINALE deposee suite aux observations du Tribunal a l'audience du 09/02/2026. Prix de cession 2.600 EUR HT ventile : incorporels 600 EUR + corporels 300 EUR + stocks 1.700 EUR. Versement deja entre les mains de l'AJ : 1.300 EUR. Indivisibilite restreinte au seul AMD Colmar 68 (les autres associations DENTEKA traitees separement). 7 emplois repris sur 9 (exclusion 2 secretaires medicales referentes). Charges augmentatives du prix : 11.000 EUR poursuite exploitation 17/12/2025-31/01/2026 + conges payes repris (y compris anterieurs au jugement) + renonciation reconstitution acomptes patients + 50.000 EUR HT indemnite resiliation bail + 146.400 EUR cession droit au bail Nanterre + reconstitution depot de garantie. Substitution faculte au profit de l'Association Centre Dentaire Enghien (creee 16/01/2026, RNA Paris W751282634 ?) avec Ishac HADDOUK President. Entree en jouissance lendemain 00h du jugement. Materiel : actifs corporels quasi exclusivement constitues d'unites de climatisation deja amorties. 18 pages + Docusign Envelope D6DFFEB7-2AD7-46C4-9620-FF4852BD7F92. Amelioration de 15-03 (1.300 EUR -> 2.600 EUR)."
15-05,15,offre_01_gd74677654.pdf,MEDIVI,SAS,17832600,908193311,"91 avenue de la Republique, 75011 Paris",David HADDOUK (President) / Sylvain HADDOUK (DG),"Reseau PLACE DENTAIRE / Reseau DENTEKA (Haddouk) - 29 centres dentaires, CA agrege 39.317.630 EUR en 2025, ~450 salaries",Offre amelioree (finale - cible indivisible Colmar),2026-02-11,"MEDIVI avec substitution Association Centre Dentaire Colmar (creee 22/01/2026, n° W751282634, President Ishac HADDOUK) + VIVA SANTE (SAS 812772382)",2600,600,500,11,"Actifs incorporels (patientele, achalandage, dossiers patients RGPD, logiciels, licences) + actifs corporels (7 lots Mercier valorises 5.430 EUR : salle de repos 100 EUR + petit electromenager 80 EUR + 2 refrigerateurs 120 EUR + table a repasser 50 EUR + lave-linge 80 EUR + stock hygiene 5.000 EUR) + stocks 1.500 EUR","Numero FINESS, tresorerie disponible, creances anterieures, biens revendiques (MUTUALEASE courrier 16/07/2025, dossier 195236), contrats CDD (sauf pro/apprentissage), acomptes patients a rembourser, contrats SI non listes","(1) Jugement designant MEDIVI repreneur ; (2) DENTIGEST + AJ resilient bail GALIMMO 06/11/2021 (L.622-14) et credit-bail BAIL ACTEA/MUTUALEASE dossier 195236 (L.622-13) contre indemnite 50.000 EUR HT ; (3) Cession du droit au bail Nanterre POINT DENTAIRE/MEDIPOLE 146.400 EUR en 7 mensualites ; (4) Reconstitution depot de garantie ; (5) Indivisibilite avec offre Enghien-les-Bains",Fonds propres exclusivement,39317630 (CA agrege Reseau PLACE DENTAIRE 2025),,,,,Jusqu'a la decision du Tribunal,Cabinet PZ Avocats - Paul ZEITOUN / Delphine MENGEOT,"OFFRE LIEE - CIBLE COLMAR (hors dossier 15). Concerne ASSOCIATION MEDICO-DENTAIRE COLMAR 68 (SIREN 905238648, RNA Paris, centre dentaire Colmar). Procedure RJ ouverte 20/08/2025 par Tribunal des activites economiques de Paris (memes AJ/MJ que dossier 15). Cessation des paiements 07/07/2025. Bailleur GALIMMO (bail 06/11/2021). 14 salaries dont 11 repris : 5 assistantes dentaires + 5 chirurgiens-dentistes omni-praticiens + 1 secretaire medicale (exclus : 1 chirurgien implantologie + 1 chirurgien orthodontie + 1 secretaire medicale). Substitution Association Centre Dentaire Colmar creee 22/01/2026 (a verifier - statuts/RNA W751282634 mentionne mais correspond a Enghien dans offre_02). Prix : 600 EUR incorporels + 500 EUR corporels + 1.500 EUR stocks. Charges augmentatives identiques a 15-04. Inclus DANS le dossier 15 au titre de l'indivisibilite des deux offres - le defaut d'adoption de l'une entraine la caducite de l'autre. 17 pages + Docusign 2A5F4D9C-F7C7-4483-A007-5A1245F660DE. Demande agrement ARS 68 avant 1er mars 2026."
